{
  "schema_version": 1,
  "tick_id": "tick-20260613T120000Z",
  "issue": 101,
  "stage": "invoice",
  "cost": {
    "tokens_in": 18432,
    "tokens_out": 5120,
    "duration_seconds": 84.5,
    "model": "anthropic/claude-sonnet-4-6"
  },
  "label_before": "claimed",
  "label_after": "pr-open",
  "timestamp": "2026-06-13T12:01:24Z",
  "dry_run": false
}
